{
  "$schema": "https://json-schema.org/draft/2020-12/schema",
  "$id": "https://github.com/zhanghao1903/macos-computer-use/blob/main/plugins/codex-claude-engineering-lifecycle/schemas/closure-record.schema.json",
  "title": "ClosureRecord",
  "type": "object",
  "additionalProperties": false,
  "required": ["releaseResultId", "requirementsMessageId", "planReviewResultMessageId", "codeReviewResultMessageId", "mergeCommitSha", "releaseTargets", "scenariosSolved", "followUps", "closedAt", "closureId"],
  "properties": {
    "releaseResultId": {"$ref": "#/$defs/digest"},
    "requirementsMessageId": {"$ref": "#/$defs/digest"},
    "planReviewResultMessageId": {"$ref": "#/$defs/digest"},
    "codeReviewResultMessageId": {"$ref": "#/$defs/digest"},
    "mergeCommitSha": {"$ref": "#/$defs/sha"},
    "releaseTargets": {"type": "array", "minItems": 1, "maxItems": 20, "uniqueItems": true, "items": {"$ref": "#/$defs/digest"}},
    "scenariosSolved": {"type": "array", "minItems": 1, "maxItems": 100, "items": {"type": "string", "minLength": 1, "maxLength": 300}},
    "followUps": {"type": "array", "maxItems": 100, "items": {"type": "string", "minLength": 1, "maxLength": 300}},
    "closedAt": {"$ref": "#/$defs/timestamp"},
    "closureId": {"$ref": "#/$defs/digest"}
  },
  "$defs": {
    "digest": {"type": "string", "pattern": "^[0-9a-f]{64}$"},
    "sha": {"type": "string", "pattern": "^[0-9a-f]{40}$"},
    "timestamp": {"type": "string", "format": "date-time", "pattern": "^\\d{4}-\\d{2}-\\d{2}T\\d{2}:\\d{2}:\\d{2}Z$"}
  }
}
